subject,from,body,timestamp
URGENT: Client escalation needs immediate response,client@verizon.com,"Critical issue with deployment. The production system is down and we need your immediate attention. Please respond ASAP.",2024-11-20T08:15:00
Meeting request: Q4 Planning,sarah@company.com,"Can we meet next week to discuss Q4 strategy? I'm thinking Tuesday or Wednesday afternoon would work. Let me know your availability.",2024-11-20T09:30:00
FYI: Weekly report,team@company.com,"Here is this week's progress report. All projects are on track. No action needed, just keeping you informed.",2024-11-20T10:00:00
Action Required: Budget approval needed,cfo@company.com,"The Q4 budget proposal requires your approval by end of day today. Please review the attached document and let me know if you have any questions.",2024-11-20T11:00:00
Re: Project timeline discussion,mike.rodriguez@company.com,"Thanks for the update. I have a few questions about the timeline. Can we schedule a quick 30-minute call to discuss? Available tomorrow morning or Friday afternoon.",2024-11-20T14:30:00
